{
  "meta": {
    "run_id": "run_20260117_100000_abc123xyz",
    "generated_at": "2026-01-17T10:00:00.000Z",
    "trigger_source": "inbound",
    "organization_name": "Community Partners Foundation",
    "organization_website": "https://communitypartners.org",
    "organization_domain": "communitypartners.org",
    "requester_name": "Sarah Johnson",
    "requester_title": "Executive Director",
    "source_urls": [
      "https://communitypartners.org/",
      "https://communitypartners.org/about",
      "https://communitypartners.org/programs",
      "https://communitypartners.org/volunteer"
    ]
  },
  "executive_summary": {
    "summary": "Community Partners Foundation is a mid-sized nonprofit dedicated to youth education and family support services in the greater metropolitan area. They serve over 2,000 families annually through after-school programs and parent workshops. Key opportunities exist in volunteer coordination, FAQ automation, and donation flow optimization.",
    "top_opportunities": [
      "Automate volunteer inquiry responses to reduce staff workload by 40%",
      "Implement AI-powered FAQ chatbot for 24/7 visitor engagement",
      "Streamline donation process with conversational assistance"
    ]
  },
  "organization_understanding": {
    "mission": "To empower youth and families through education, mentorship, and community support services that build stronger neighborhoods.",
    "programs": [
      {
        "name": "After-School Excellence",
        "summary": "Provides academic tutoring and enrichment activities for K-8 students at 5 community sites."
      },
      {
        "name": "Parent University",
        "summary": "Offers workshops and resources to help parents support their children's educational journey."
      },
      {
        "name": "Youth Mentorship Network",
        "summary": "Matches adult volunteers with teens for one-on-one mentoring relationships."
      }
    ],
    "audiences": [
      "K-8 students seeking academic support",
      "Parents and caregivers",
      "Adult volunteers interested in mentorship",
      "Community donors and supporters"
    ]
  },
  "website_analysis": {
    "overall_tone": "Warm, welcoming, and community-focused with clear calls to action for volunteers and donors.",
    "strengths": [
      "Clear program descriptions with impact metrics",
      "Multiple ways to get involved prominently displayed",
      "Strong testimonials from families served"
    ],
    "gaps": [
      "FAQ page is outdated and incomplete",
      "Volunteer application process requires multiple page loads",
      "No chat support for immediate visitor questions"
    ],
    "volunteer_flow_observations": "Volunteer page exists but application requires downloading a PDF form and emailing it back. No online submission option creates friction.",
    "donation_flow_observations": "Donation page uses a third-party platform with clean integration. Supports recurring donations but lacks suggested giving levels based on impact."
  },
  "leadership_and_staff": {
    "executive_leader": {
      "name": "Sarah Johnson",
      "role": "Executive Director",
      "summary": "Sarah has led the organization for 8 years, growing it from serving 500 to over 2,000 families annually. Background in education administration and nonprofit management."
    },
    "other_staff_mentions": [
      {
        "name": "Michael Chen",
        "role": "Program Director"
      },
      {
        "name": "Lisa Martinez",
        "role": "Volunteer Coordinator"
      }
    ]
  },
  "requester_profile": {
    "summary": "Sarah Johnson is a seasoned nonprofit leader focused on operational efficiency and expanding organizational impact. She has previously implemented CRM systems and is comfortable with technology adoption.",
    "conversation_angle": "Focus on how AI can help scale their impact without proportionally increasing staff workload, particularly around volunteer coordination and donor engagement."
  },
  "artificial_intelligence_opportunities": [
    {
      "title": "Volunteer Inquiry Automation",
      "why_it_matters": "Lisa Martinez spends 15+ hours weekly responding to similar volunteer questions. Automating FAQs would free her to focus on volunteer retention and training.",
      "demonstration_hook": "Show a chatbot handling common questions like 'What's the time commitment?' and 'Do I need a background check?' with instant, accurate responses."
    },
    {
      "title": "24/7 Program Information Assistant",
      "why_it_matters": "Parents often browse the website after work hours when staff aren't available. An AI assistant could answer program questions and capture enrollment interest.",
      "demonstration_hook": "Demonstrate a parent asking about after-school program locations and registration deadlines, receiving personalized responses."
    },
    {
      "title": "Donor Engagement Enhancement",
      "why_it_matters": "The donation page lacks guidance on giving levels and impact. Conversational AI could help donors understand how their contribution makes a difference.",
      "demonstration_hook": "Show an interaction where a potential donor asks what $50 provides, and the AI responds with specific impact examples."
    }
  ],
  "demonstration_plan": {
    "opening": "Thank you for your time today, Sarah. I understand you're looking to expand your impact while managing a lean team. Let me show you how AI can help.",
    "steps": [
      "Begin with the volunteer FAQ scenario since this addresses Lisa's biggest pain point",
      "Show the parent inquiry flow to demonstrate after-hours engagement",
      "Demonstrate the donation conversation to connect giving to impact",
      "Highlight the admin dashboard for tracking conversations and insights",
      "Discuss implementation timeline and training support"
    ],
    "example_bot_responses": [
      "Hi! I'd love to help you learn about volunteering with Community Partners. Our programs have flexible time commitments - from 2 hours weekly to full-day events. What type of volunteering interests you most?",
      "Great question! Our After-School Excellence program runs at 5 locations: Lincoln Elementary, Washington Middle School, Jefferson Community Center, MLK Library, and Riverside Recreation Center. Which area is most convenient for you?"
    ]
  },
  "objections_and_rebuttals": [
    {
      "objection": "We don't have the technical expertise to implement and maintain an AI system.",
      "rebuttal": "MyRecruiter provides full implementation support and ongoing training. Our platform is designed for non-technical users, and we include dedicated onboarding to ensure your team feels confident."
    },
    {
      "objection": "Our donors and volunteers might prefer talking to a real person.",
      "rebuttal": "The AI handles routine inquiries while seamlessly escalating complex questions to your team. This actually increases personal attention for interactions that need it most, while ensuring no one waits for basic information."
    },
    {
      "objection": "We're concerned about the cost given our limited budget.",
      "rebuttal": "Consider the time Lisa currently spends on repetitive inquiries - at 15 hours weekly, that's significant staff capacity. Most organizations see ROI within 3 months through time savings alone. We also offer nonprofit pricing tiers."
    }
  ],
  "opening_script": "Hi Sarah, thank you for taking the time to meet today. I've been learning about Community Partners' incredible work with families in the area. I'd love to explore how AI-powered engagement could help you reach more people while giving your team time back for the hands-on work that matters most.",
  "follow_up_emails": {
    "short_version": {
      "subject": "AI Solutions for Community Partners - Next Steps",
      "body": "Sarah, thank you for the conversation today. As discussed, MyRecruiter can help automate volunteer inquiries, provide 24/7 program information, and enhance donor engagement. I'll send over a customized proposal with nonprofit pricing by Friday. Looking forward to potentially supporting your mission."
    },
    "warm_version": {
      "subject": "Great Conversation Today - Excited About the Possibilities",
      "body": "Sarah, I really enjoyed learning more about Community Partners' impact today. It's clear your team is dedicated to maximizing every resource for the families you serve. Based on our discussion, I believe the volunteer inquiry automation would have the most immediate impact on Lisa's workload. The 24/7 program assistant could also help capture those after-hours parent inquiries you mentioned. I'll prepare a tailored proposal with our nonprofit pricing tier that addresses these priorities. Expect it by Friday. In the meantime, feel free to reach out with any questions. I'm excited about the potential to support your mission."
    }
  }
}
